{
  "tenant_id": "tenant-acme",
  "correlation_id": "corr-0001",
  "idempotency_key": "idem-server-reg-0001",
  "actor": {
    "type": "service",
    "id": "control-center"
  },
  "operation": "register",
  "server": {
    "hostname": "web-01.example.com",
    "platform": {
      "os": "ubuntu",
      "version": "24.04",
      "arch": "amd64"
    }
  },
  "capabilities": [
    "backup",
    "status"
  ],
  "enrollment_secret_ref": {
    "store": "env",
    "key": "OMES_ENROLLMENT_TOKEN"
  }
}
